{"schemaVersion": "1", "ok": false, "command": "evolve", "data": null, "error": {"code": "ToolOperationError", "message": "OMP exited 1: Working...\n402 Insufficient Balance (request_id: be204794-b17c-4dca-ad6d-babaf763c021)\nInsufficient Balance (request_id: be204794-b17c-4dca-ad6d-babaf763c021) (type=unknown_error param=invalid_request_error); incomplete archive: D:\\projects\\reverse-skill-evolver\\repair-open-issues-15\\reports\\omp-live-2026-10-13\\full-suite"}}
